

Run Date,Action,Symbol,Description,Type,Price ($),Quantity,Commission ($),Fees ($),Accrued Interest ($),Amount ($),Cash Balance ($),Settlement Date
04/27/2026,"YOU BOUGHT ASSIGNED PUTS AS OF 04-24-26 RED CAT HLDGS INC COM (RCAT) (Cash)",RCAT,"RED CAT HLDGS INC COM",Cash,12.5,200,,,,-2500,Processing,04/27/2026
04/27/2026,"EXPIRED PUT (UAMY) UNITED STATES APR 24 26 $9.5 as of Apr-24-2026 PUT (UAMY) UNITED STATES APR 24 26 $9.5 (100 SHS) (Cash)", -UAMY260424P9.5,"PUT (UAMY) UNITED STATES APR 24 26 $9.5 (100 SHS)",Cash,,2,,,,0.00,Processing,
04/27/2026,"ASSIGNED as of Apr-24-2026 PUT (RCAT) RED CAT HLDGS INC APR 24 26 $12.5 (100 SHS) (Cash)", -RCAT260424P12.5,"PUT (RCAT) RED CAT HLDGS INC APR 24 26 $12.5 (100 SHS)",Cash,,2,,,,0.00,Processing,
04/24/2026,"YOU SOLD OPENING TRANSACTION PUT (UMAC) UNUSUAL MACHS INC MAY 01 26 $13.5 (100 SHS) (Cash)", -UMAC260501P13.5,"PUT (UMAC) UNUSUAL MACHS INC MAY 01 26 $13.5 (100 SHS)",Cash,0.41,-1,0.65,0.02,,40.33,10252.02,04/27/2026
04/24/2026,"YOU SOLD OPENING TRANSACTION PUT (UEC) URANIUM ENERGY CORP MAY 01 26 $13.5 (100 SHS) (Cash)", -UEC260501P13.5,"PUT (UEC) URANIUM ENERGY CORP MAY 01 26 $13.5 (100 SHS)",Cash,0.22,-1,0.65,0.02,,21.33,10211.69,04/27/2026
04/24/2026,"YOU SOLD OPENING TRANSACTION PUT (TMC) TMC THE METALS CO MAY 01 26 $5 (100 SHS) (Cash)", -TMC260501P5,"PUT (TMC) TMC THE METALS CO MAY 01 26 $5 (100 SHS)",Cash,0.19,-1,0.65,0.02,,18.33,10190.36,04/27/2026
04/24/2026,"YOU BOUGHT CLOSING TRANSACTION PUT (AG) FIRST MAJESTIC APR 24 26 $20 (100 SHS) (Cash)", -AG260424P20,"PUT (AG) FIRST MAJESTIC APR 24 26 $20 (100 SHS)",Cash,0.06,1,,0.02,,-6.02,10172.03,04/27/2026
04/23/2026,"YOU SOLD OPENING TRANSACTION PUT (ONDS) ONDAS INC COMMON MAY 01 26 $9.5 (100 SHS) (Cash)", -ONDS260501P9.5,"PUT (ONDS) ONDAS INC COMMON MAY 01 26 $9.5 (100 SHS)",Cash,0.2,-1,0.65,0.02,,19.33,10178.05,04/24/2026
04/23/2026,"YOU SOLD OPENING TRANSACTION PUT (RCAT) RED CAT HLDGS INC APR 24 26 $12.5 (100 SHS) (Cash)", -RCAT260424P12.5,"PUT (RCAT) RED CAT HLDGS INC APR 24 26 $12.5 (100 SHS)",Cash,0.17,-1,0.65,0.02,,16.33,10158.72,04/24/2026
04/23/2026,"YOU SOLD OPENING TRANSACTION PUT (RCAT) RED CAT HLDGS INC APR 24 26 $12.5 (100 SHS) (Cash)", -RCAT260424P12.5,"PUT (RCAT) RED CAT HLDGS INC APR 24 26 $12.5 (100 SHS)",Cash,0.26,-1,0.65,0.02,,25.33,10142.39,04/24/2026
04/23/2026,"YOU BOUGHT CLOSING TRANSACTION PUT (NOK) NOKIA OYJ ADR EACH APR 24 26 $9.5 (100 SHS) (Cash)", -NOK260424P9.5,"PUT (NOK) NOKIA OYJ ADR EACH APR 24 26 $9.5 (100 SHS)",Cash,0.01,2,,0.05,,-2.05,10117.06,04/24/2026
04/22/2026,"YOU SOLD OPENING TRANSACTION PUT (NOK) NOKIA OYJ ADR EACH APR 24 26 $9.5 (100 SHS) (Cash)", -NOK260424P9.5,"PUT (NOK) NOKIA OYJ ADR EACH APR 24 26 $9.5 (100 SHS)",Cash,0.2,-1,0.65,0.02,,19.33,10119.11,04/23/2026
04/22/2026,"YOU SOLD OPENING TRANSACTION PUT (NOK) NOKIA OYJ ADR EACH APR 24 26 $9.5 (100 SHS) (Cash)", -NOK260424P9.5,"PUT (NOK) NOKIA OYJ ADR EACH APR 24 26 $9.5 (100 SHS)",Cash,0.28,-1,0.65,0.02,,27.33,10099.78,04/23/2026
04/21/2026,"YOU SOLD OPENING TRANSACTION PUT (UAMY) UNITED STATES APR 24 26 $9.5 (100 SHS) (Cash)", -UAMY260424P9.5,"PUT (UAMY) UNITED STATES APR 24 26 $9.5 (100 SHS)",Cash,0.1,-1,0.5,0.02,,9.48,10072.45,04/22/2026
04/21/2026,"YOU SOLD OPENING TRANSACTION PUT (UAMY) UNITED STATES APR 24 26 $9.5 (100 SHS) (Cash)", -UAMY260424P9.5,"PUT (UAMY) UNITED STATES APR 24 26 $9.5 (100 SHS)",Cash,0.15,-1,0.65,0.02,,14.33,10062.97,04/22/2026
04/20/2026,"YOU SOLD OPENING TRANSACTION PUT (AG) FIRST MAJESTIC APR 24 26 $20 (100 SHS) (Cash)", -AG260424P20,"PUT (AG) FIRST MAJESTIC APR 24 26 $20 (100 SHS)",Cash,0.32,-1,0.65,0.02,,31.33,10048.64,04/21/2026
04/20/2026,"YOU BOUGHT CLOSING TRANSACTION PUT (ONDS) ONDAS INC COMMON APR 24 26 $9.5 (100 SHS) (Cash)", -ONDS260424P9.5,"PUT (ONDS) ONDAS INC COMMON APR 24 26 $9.5 (100 SHS)",Cash,0.13,1,,0.02,,-13.02,10017.31,04/21/2026
04/20/2026,"YOU SOLD OPENING TRANSACTION PUT (ONDS) ONDAS INC COMMON APR 24 26 $9.5 (100 SHS) (Cash)", -ONDS260424P9.5,"PUT (ONDS) ONDAS INC COMMON APR 24 26 $9.5 (100 SHS)",Cash,0.31,-1,0.65,0.02,,30.33,10030.33,04/21/2026
04/20/2026,"TRANSFERRED FROM VS 237-815769-1 (Cash)", ,"No Description",Cash,,0.000,,,,10000,10000.00,



"The data and information in this spreadsheet is provided to you solely for your use and is not for distribution. The spreadsheet is provided for"
"informational purposes only, and is not intended to provide advice, nor should it be construed as an offer to sell, a solicitation of an offer to buy or a"
"recommendation for any security or insurance product by Fidelity or any third party. Data and information shown is based on information known to Fidelity as of the date it was"
"exported and is subject to change. It should not be used in place of your account statements or trade confirmations and is not intended for tax reporting"
"purposes. For more information on the data included in this spreadsheet, including any limitations thereof, go to Fidelity.com."

"Brokerage services are provided by Fidelity Brokerage Services LLC (FBS), 900 Salem Street, Smithfield, RI 02917. Custody and other services provided by National"
"Financial Services LLC (NFS). Both are Fidelity Investment companies and members SIPC, NYSE. Insurance products at Fidelity are distributed by"
"Fidelity Insurance Agency, Inc., and, for certain products, by Fidelity Brokerage Services, Member NYSE, SIPC."

Date downloaded 04/26/2026 9:56 am